2026-06-13T05:31:05.541894,gr-ns-bulk-buying-guide-best-value-options,Grüns Bulk Buying Guide: Best Value Options — honest review,https://reddit.com/r/Grunsgummies/comments/1u4prbz/grüns_bulk_buying_guide_best_value_options_honest/
2026-06-13T05:32:06.163913,gr-ns-for-cataracts-vision-protection-nutrients,Grüns for Cataracts: Vision Protection Nutrients — honest review,https://reddit.com/r/Grunsgummies/comments/1u4ps47/grüns_for_cataracts_vision_protection_nutrients/
2026-06-13T05:33:06.682306,gr-ns-for-cavities-prevention-dental-health,Grüns for Cavities Prevention: Dental Health — honest review,https://reddit.com/r/Grunsgummies/comments/1u4psun/grüns_for_cavities_prevention_dental_health/
2026-06-13T05:34:07.118526,gr-ns-for-celiac-disease-gluten-free-greens,Grüns for Celiac Disease: Gluten Free Greens — honest review,https://reddit.com/r/Grunsgummies/comments/1u4ptle/grüns_for_celiac_disease_gluten_free_greens/
2026-06-13T05:35:07.584029,gr-ns-for-chronic-fatigue-energy-boost-guide,Grüns for Chronic Fatigue: Energy Boost Guide — honest review,https://reddit.com/r/Grunsgummies/comments/1u4puc5/grüns_for_chronic_fatigue_energy_boost_guide/
2026-06-13T05:36:08.135119,gr-ns-for-crohn-s-disease-nutritional-management,Grüns for Crohn's Disease: Nutritional Management — honest review,https://reddit.com/r/Grunsgummies/comments/1u4pv3j/grüns_for_crohns_disease_nutritional_management/
2026-06-13T05:37:08.666115,gr-ns-for-diabetic-neuropathy-nerve-health,Grüns for Diabetic Neuropathy: Nerve Health — honest review,https://reddit.com/r/Grunsgummies/comments/1u4pvuz/grüns_for_diabetic_neuropathy_nerve_health_honest/
2026-06-13T05:38:09.174721,gr-ns-for-diabetic-retinopathy-eye-complication-prevention,Grüns for Diabetic Retinopathy: Eye Complication Prevention — honest review,https://reddit.com/r/Grunsgummies/comments/1u4pwmy/grüns_for_diabetic_retinopathy_eye_complication/
2026-06-13T05:39:09.695607,gr-ns-for-erectile-dysfunction-natural-performance-support,Grüns for Erectile Dysfunction: Natural Performance Support — honest review,https://reddit.com/r/Grunsgummies/comments/1u4pxdu/grüns_for_erectile_dysfunction_natural/
2026-06-13T05:40:10.236344,gr-ns-for-fatty-liver-disease-nutrition-reversal,Grüns for Fatty Liver Disease: Nutrition Reversal — honest review,https://reddit.com/r/Grunsgummies/comments/1u4py31/grüns_for_fatty_liver_disease_nutrition_reversal/
